{
  "apiVersion": "dashboard.grafana.app/v2",
  "kind": "Dashboard",
  "metadata": {
    "name": "m2-tabs"
  },
  "spec": {
    "annotations": [],
    "cursorSync": "Off",
    "description": "",
    "editable": true,
    "elements": {
      "p1": {
        "kind": "Panel",
        "spec": {
          "data": {
            "kind": "QueryGroup",
            "spec": {
              "queries": [],
              "queryOptions": {},
              "transformations": []
            }
          },
          "description": "",
          "id": 1,
          "links": [],
          "title": "A",
          "vizConfig": {
            "kind": "text",
            "spec": {
              "fieldConfig": {
                "defaults": {},
                "overrides": []
              },
              "options": {
                "content": "**a**",
                "mode": "markdown"
              }
            }
          }
        }
      },
      "p2": {
        "kind": "Panel",
        "spec": {
          "data": {
            "kind": "QueryGroup",
            "spec": {
              "queries": [],
              "queryOptions": {},
              "transformations": []
            }
          },
          "description": "",
          "id": 2,
          "links": [],
          "title": "B",
          "vizConfig": {
            "kind": "text",
            "spec": {
              "fieldConfig": {
                "defaults": {},
                "overrides": []
              },
              "options": {
                "content": "**b**",
                "mode": "markdown"
              }
            }
          }
        }
      }
    },
    "layout": {
      "kind": "TabsLayout",
      "spec": {
        "tabs": [
          {
            "kind": "TabsLayoutTab",
            "spec": {
              "layout": {
                "kind": "RowsLayout",
                "spec": {
                  "rows": [
                    {
                      "kind": "RowsLayoutRow",
                      "spec": {
                        "collapse": false,
                        "layout": {
                          "kind": "GridLayout",
                          "spec": {
                            "items": [
                              {
                                "kind": "GridLayoutItem",
                                "spec": {
                                  "element": {
                                    "kind": "ElementReference",
                                    "name": "p1"
                                  },
                                  "height": 6,
                                  "width": 24,
                                  "x": 0,
                                  "y": 0
                                }
                              }
                            ]
                          }
                        },
                        "title": "R1"
                      }
                    }
                  ]
                }
              },
              "title": "Rows"
            }
          },
          {
            "kind": "TabsLayoutTab",
            "spec": {
              "layout": {
                "kind": "AutoGridLayout",
                "spec": {
                  "columnWidthMode": "standard",
                  "fillScreen": false,
                  "items": [
                    {
                      "kind": "AutoGridLayoutItem",
                      "spec": {
                        "element": {
                          "kind": "ElementReference",
                          "name": "p2"
                        }
                      }
                    }
                  ],
                  "maxColumnCount": 2,
                  "rowHeightMode": "standard"
                }
              },
              "title": "Auto"
            }
          }
        ]
      }
    },
    "links": [],
    "liveNow": false,
    "preload": false,
    "tags": [
      "m2"
    ],
    "timeSettings": {
      "autoRefresh": "",
      "autoRefreshIntervals": [],
      "from": "now-6h",
      "hideTimepicker": false,
      "timezone": "browser",
      "to": "now"
    },
    "title": "M2 Tabs",
    "variables": []
  }
}
