{
  "apiVersion": "dashboard.grafana.app/v2",
  "kind": "Dashboard",
  "metadata": {
    "name": "portable-reference"
  },
  "spec": {
    "annotations": [],
    "cursorSync": "Off",
    "description": "One neutral model lowered to Grafana v2 and Perses.",
    "editable": true,
    "elements": {
      "intro": {
        "kind": "Panel",
        "spec": {
          "data": {
            "kind": "QueryGroup",
            "spec": {
              "queries": [],
              "queryOptions": {},
              "transformations": []
            }
          },
          "description": "",
          "id": 1,
          "links": [],
          "title": "Overview",
          "vizConfig": {
            "kind": "text",
            "spec": {
              "fieldConfig": {
                "defaults": {},
                "overrides": []
              },
              "options": {
                "content": "**Portable** dashboard",
                "mode": "markdown"
              }
            }
          }
        }
      },
      "logs": {
        "kind": "Panel",
        "spec": {
          "data": {
            "kind": "QueryGroup",
            "spec": {
              "queries": [
                {
                  "kind": "PanelQuery",
                  "spec": {
                    "hidden": false,
                    "query": {
                      "datasource": {
                        "name": "loki"
                      },
                      "group": "loki",
                      "kind": "DataQuery",
                      "spec": {
                        "expr": "{app=\"api\"} |= \"error\"",
                        "refId": "A"
                      },
                      "version": "v0"
                    },
                    "refId": "A"
                  }
                }
              ],
              "queryOptions": {},
              "transformations": []
            }
          },
          "description": "",
          "id": 3,
          "links": [],
          "title": "Errors",
          "vizConfig": {
            "kind": "logs",
            "spec": {
              "fieldConfig": {
                "defaults": {},
                "overrides": []
              },
              "options": {
                "dedupStrategy": "none",
                "enableLogDetails": true,
                "showLabels": false,
                "showTime": true,
                "sortOrder": "Ascending",
                "wrapLogMessage": true
              }
            }
          }
        }
      },
      "rate": {
        "kind": "Panel",
        "spec": {
          "data": {
            "kind": "QueryGroup",
            "spec": {
              "queries": [
                {
                  "kind": "PanelQuery",
                  "spec": {
                    "hidden": false,
                    "query": {
                      "datasource": {
                        "name": "$datasource"
                      },
                      "group": "prometheus",
                      "kind": "DataQuery",
                      "spec": {
                        "expr": "sum(rate(http_requests_total{env=\"$environment\"}[5m]))",
                        "refId": "A"
                      },
                      "version": "v0"
                    },
                    "refId": "A"
                  }
                }
              ],
              "queryOptions": {},
              "transformations": []
            }
          },
          "description": "",
          "id": 2,
          "links": [],
          "title": "Request rate",
          "vizConfig": {
            "kind": "timeseries",
            "spec": {
              "fieldConfig": {
                "defaults": {
                  "thresholds": {
                    "mode": "absolute",
                    "steps": [
                      {
                        "color": "green",
                        "value": null
                      },
                      {
                        "color": "red",
                        "value": 10.0
                      }
                    ]
                  },
                  "unit": "count"
                },
                "overrides": []
              },
              "options": {}
            }
          }
        }
      }
    },
    "layout": {
      "kind": "RowsLayout",
      "spec": {
        "rows": [
          {
            "kind": "RowsLayoutRow",
            "spec": {
              "collapse": false,
              "layout": {
                "kind": "GridLayout",
                "spec": {
                  "items": [
                    {
                      "kind": "GridLayoutItem",
                      "spec": {
                        "element": {
                          "kind": "ElementReference",
                          "name": "intro"
                        },
                        "height": 4,
                        "width": 24,
                        "x": 0,
                        "y": 0
                      }
                    }
                  ]
                }
              },
              "title": "Introduction"
            }
          },
          {
            "kind": "RowsLayoutRow",
            "spec": {
              "collapse": false,
              "layout": {
                "kind": "GridLayout",
                "spec": {
                  "items": [
                    {
                      "kind": "GridLayoutItem",
                      "spec": {
                        "element": {
                          "kind": "ElementReference",
                          "name": "rate"
                        },
                        "height": 8,
                        "width": 12,
                        "x": 0,
                        "y": 0
                      }
                    },
                    {
                      "kind": "GridLayoutItem",
                      "spec": {
                        "element": {
                          "kind": "ElementReference",
                          "name": "logs"
                        },
                        "height": 8,
                        "width": 12,
                        "x": 12,
                        "y": 0
                      }
                    }
                  ]
                }
              },
              "title": "Signals"
            }
          }
        ]
      }
    },
    "links": [],
    "liveNow": false,
    "preload": false,
    "tags": [
      "portable",
      "golden"
    ],
    "timeSettings": {
      "autoRefresh": "",
      "autoRefreshIntervals": [],
      "from": "now-6h",
      "hideTimepicker": false,
      "timezone": "browser",
      "to": "now"
    },
    "title": "Portable reference",
    "variables": [
      {
        "kind": "CustomVariable",
        "spec": {
          "current": {
            "text": "prod",
            "value": "prod"
          },
          "hide": "dontHide",
          "includeAll": false,
          "multi": false,
          "name": "environment",
          "options": [
            {
              "selected": true,
              "text": "prod",
              "value": "prod"
            },
            {
              "selected": false,
              "text": "staging",
              "value": "staging"
            }
          ],
          "query": "prod,staging",
          "skipUrlSync": false
        }
      }
    ]
  }
}
