{
  "apiVersion": "dashboard.grafana.app/v2",
  "kind": "Dashboard",
  "metadata": {
    "name": "m3-cond"
  },
  "spec": {
    "annotations": [],
    "cursorSync": "Off",
    "description": "",
    "editable": true,
    "elements": {
      "p1": {
        "kind": "Panel",
        "spec": {
          "data": {
            "kind": "QueryGroup",
            "spec": {
              "queries": [],
              "queryOptions": {},
              "transformations": []
            }
          },
          "description": "",
          "id": 1,
          "links": [],
          "title": "Shielded",
          "vizConfig": {
            "kind": "text",
            "spec": {
              "fieldConfig": {
                "defaults": {},
                "overrides": []
              },
              "options": {
                "content": "for beginners",
                "mode": "markdown"
              }
            }
          }
        }
      },
      "p2": {
        "kind": "Panel",
        "spec": {
          "data": {
            "kind": "QueryGroup",
            "spec": {
              "queries": [],
              "queryOptions": {},
              "transformations": []
            }
          },
          "description": "",
          "id": 2,
          "links": [],
          "title": "Adv",
          "vizConfig": {
            "kind": "text",
            "spec": {
              "fieldConfig": {
                "defaults": {},
                "overrides": []
              },
              "options": {
                "content": "x",
                "mode": "markdown"
              }
            }
          }
        }
      }
    },
    "layout": {
      "kind": "RowsLayout",
      "spec": {
        "rows": [
          {
            "kind": "RowsLayoutRow",
            "spec": {
              "collapse": false,
              "conditionalRendering": {
                "kind": "ConditionalRenderingGroup",
                "spec": {
                  "condition": "and",
                  "items": [
                    {
                      "kind": "ConditionalRenderingVariable",
                      "spec": {
                        "operator": "equals",
                        "value": "beginner",
                        "variable": "audience"
                      }
                    }
                  ],
                  "visibility": "show"
                }
              },
              "layout": {
                "kind": "GridLayout",
                "spec": {
                  "items": [
                    {
                      "kind": "GridLayoutItem",
                      "spec": {
                        "element": {
                          "kind": "ElementReference",
                          "name": "p1"
                        },
                        "height": 6,
                        "width": 24,
                        "x": 0,
                        "y": 0
                      }
                    }
                  ]
                }
              },
              "title": "Beginner only"
            }
          },
          {
            "kind": "RowsLayoutRow",
            "spec": {
              "collapse": false,
              "conditionalRendering": {
                "kind": "ConditionalRenderingGroup",
                "spec": {
                  "condition": "and",
                  "items": [
                    {
                      "kind": "ConditionalRenderingVariable",
                      "spec": {
                        "operator": "equals",
                        "value": "advanced",
                        "variable": "audience"
                      }
                    },
                    {
                      "kind": "ConditionalRenderingData",
                      "spec": {
                        "value": true
                      }
                    }
                  ],
                  "visibility": "show"
                }
              },
              "layout": {
                "kind": "GridLayout",
                "spec": {
                  "items": [
                    {
                      "kind": "GridLayoutItem",
                      "spec": {
                        "element": {
                          "kind": "ElementReference",
                          "name": "p2"
                        },
                        "height": 6,
                        "width": 24,
                        "x": 0,
                        "y": 0
                      }
                    }
                  ]
                }
              },
              "title": "Advanced AND has-data"
            }
          }
        ]
      }
    },
    "links": [],
    "liveNow": false,
    "preload": false,
    "tags": [
      "m3"
    ],
    "timeSettings": {
      "autoRefresh": "",
      "autoRefreshIntervals": [],
      "from": "now-6h",
      "hideTimepicker": false,
      "timezone": "browser",
      "to": "now"
    },
    "title": "M3 Conditional",
    "variables": [
      {
        "kind": "CustomVariable",
        "spec": {
          "current": {
            "text": "beginner",
            "value": "beginner"
          },
          "hide": "dontHide",
          "includeAll": false,
          "multi": false,
          "name": "audience",
          "options": [
            {
              "selected": true,
              "text": "beginner",
              "value": "beginner"
            },
            {
              "selected": false,
              "text": "intermediate",
              "value": "intermediate"
            },
            {
              "selected": false,
              "text": "advanced",
              "value": "advanced"
            }
          ],
          "query": "beginner,intermediate,advanced",
          "skipUrlSync": false
        }
      }
    ]
  }
}
